{
  "name": "k8s-sidecar-testing",
  "version": "2.0.0",
  "description": "Project-specific Kubernetes test helpers with bounded commands, accurate failure reporting, and scoped cleanup.",
  "author": {
    "name": "Sekou Doumbouya",
    "url": "https://github.com/fakoli"
  },
  "repository": "https://github.com/fakoli/fakoli-plugins",
  "license": "MIT",
  "keywords": [
    "kubernetes",
    "testing",
    "ipv6",
    "sidecar",
    "k3s",
    "multipass",
    "nat464"
  ]
}
