{
  "name": "fakoli-crew",
  "version": "2.10.0",
  "description": "Nine specialist AI agents for software engineering \u2014 generalist roles (polyglot architect, code reviewer, security auditor, researcher, plugin engineer, integration specialist, documentation writer, infrastructure keeper, QA validator) with TDD enforcement, systematic debugging, and verification gates. Plugin-surface critics (agent/skill/hook/mcp/structure) moved to fakoli-plugin-critic in 2.3.0.",
  "author": {
    "name": "Sekou Doumbouya",
    "url": "https://github.com/fakoli"
  },
  "repository": "https://github.com/fakoli/fakoli-plugins",
  "license": "MIT",
  "keywords": [
    "agents",
    "team",
    "crew",
    "orchestration",
    "code-review",
    "typescript",
    "architecture",
    "workflow"
  ]
}
