{
  "name": "marketplace-manager",
  "version": "2.0.1",
  "description": "Manage the fakoli-plugins marketplace: add/remove plugins, validate manifests, and regenerate registry indices",
  "author": {
    "name": "Sekou Doumbouya",
    "url": "https://github.com/fakoli"
  },
  "repository": "https://github.com/fakoli/fakoli-plugins",
  "license": "MIT",
  "keywords": [
    "marketplace",
    "plugin-management",
    "registry",
    "validation"
  ]
}
