{
  "name": "safe-fetch",
  "version": "1.1.4",
  "description": "Fetch public pages with network policy and content sanitization; search via a configured Brave API. Sanitized output remains untrusted.",
  "author": {
    "name": "Sekou Doumbouya",
    "url": "https://github.com/fakoli"
  },
  "repository": "https://github.com/fakoli/fakoli-plugins",
  "license": "MIT",
  "keywords": [
    "security",
    "web-fetch",
    "sanitization",
    "prompt-injection",
    "ssrf",
    "mcp",
    "web-search"
  ],
  "mcpServers": "./.mcp.json"
}
