{
  "name": "gws-plugin",
  "version": "0.3.4",
  "description": "Operate across all Google Workspace services using the gws CLI — 100 skills, 15 slash commands, 11 role-based agents, and 44 automation recipes covering email, calendar, drive, docs, sheets, slides, tasks, chat, meet, forms, classroom, keep, people, events, admin reports, model armor, and apps script.",
  "author": {
    "name": "Sekou Doumbouya",
    "url": "https://github.com/fakoli"
  },
  "repository": "https://github.com/fakoli/fakoli-plugins",
  "license": "MIT",
  "keywords": [
    "google-workspace",
    "gmail",
    "calendar",
    "drive",
    "sheets",
    "docs",
    "slides",
    "tasks",
    "chat",
    "meet",
    "forms",
    "classroom",
    "keep",
    "people",
    "events",
    "admin-reports",
    "modelarmor",
    "productivity",
    "gws",
    "persona",
    "executive-assistant",
    "project-manager",
    "hr-coordinator",
    "sales-ops",
    "it-admin",
    "content-creator",
    "customer-support",
    "event-coordinator",
    "team-lead",
    "researcher",
    "recipe",
    "workflow",
    "automation"
  ]
}
