{
  "name": "session-retro",
  "version": "1.3.0",
  "description": "Analyze local coding sessions with tables and HTML reports",
  "author": {
    "name": "Sekou Doumbouya",
    "url": "https://github.com/fakoli"
  },
  "repository": "https://github.com/fakoli/fakoli-plugins",
  "license": "MIT",
  "keywords": [
    "session",
    "retro",
    "analytics",
    "observability",
    "tokens",
    "workflows",
    "post-session",
    "productivity",
    "evaluation"
  ]
}
