{
  "name": "google-workspace",
  "version": "1.0.0",
  "description": "Google Workspace integration via gws CLI — Drive, Sheets, Docs, Slides, Gmail, Calendar, Tasks, Chat, People, Keep, and 50+ workflows, personas, and recipes.",
  "author": {
    "name": "Sekou Doumbouya",
    "url": "https://github.com/fakoli"
  },
  "repository": "https://github.com/fakoli/fakoli-plugins",
  "license": "MIT",
  "keywords": [
    "google-workspace",
    "gws",
    "drive",
    "sheets",
    "docs",
    "gmail",
    "calendar",
    "productivity"
  ]
}
