{
  "name": "gate-router",
  "version": "1.1.0",
  "description": "Map changed Git files to local verification commands",
  "author": {
    "name": "Sekou Doumbouya",
    "url": "https://github.com/fakoli"
  },
  "repository": "https://github.com/fakoli/fakoli-plugins",
  "license": "MIT",
  "keywords": [
    "verification",
    "gates",
    "changed-files",
    "pre-commit",
    "workflow"
  ]
}
