{
  "name": "handoff",
  "version": "0.3.1",
  "description": "Project handoff notes across sessions and checkouts",
  "author": {
    "name": "Sekou Doumbouya",
    "url": "https://github.com/fakoli"
  },
  "license": "MIT",
  "homepage": "https://github.com/fakoli/fakoli-plugins/tree/main/plugins/handoff",
  "repository": "https://github.com/fakoli/fakoli-plugins",
  "keywords": [
    "memory",
    "handoff",
    "session",
    "worktree",
    "context",
    "resume"
  ]
}
