{
  "name": "session-evals",
  "version": "1.2.0",
  "description": "Build and run deterministic evals from coding sessions",
  "author": {
    "name": "Sekou Doumbouya",
    "url": "https://github.com/fakoli"
  },
  "repository": "https://github.com/fakoli/fakoli-plugins",
  "license": "MIT",
  "keywords": [
    "evals",
    "local-models",
    "anvil-serving",
    "sessions",
    "benchmarking",
    "routing"
  ]
}
