{
  "name": "recall-mode-verifier",
  "version": "1.1.0",
  "description": "Review changes for concrete failure modes and evidence",
  "author": {
    "name": "Sekou Doumbouya",
    "url": "https://github.com/fakoli"
  },
  "repository": "https://github.com/fakoli/fakoli-plugins",
  "license": "MIT",
  "keywords": [
    "verification",
    "adversarial-review",
    "red-team",
    "testing",
    "anvil"
  ]
}
