{
  "name": "systems-thinking",
  "version": "0.4.0",
  "description": "Apply systems thinking to infrastructure decisions so you stop discovering hidden costs, vendor assumptions, and scaling traps after you've committed. Extract what vendors bury in their docs, map dependencies the design review missed, reuse what worked before instead of forgetting lessons, and produce structured artifacts grounded in source evidence \u2014 not confident guesses.",
  "author": {
    "name": "Sekou Doumbouya"
  },
  "repository": "https://github.com/fakoli/fakoli-plugins",
  "license": "MIT",
  "keywords": [
    "infrastructure",
    "architecture",
    "complexity",
    "risk-analysis",
    "decision-support",
    "vendor-evaluation",
    "network-engineering"
  ]
}
