{
  "name": "fakoli-state",
  "version": "1.24.0",
  "description": "Local-first, runtime-neutral project state for humans and AI coding agents \u2014 turn PRDs into lockable, evidence-backed work packets.",
  "author": {
    "name": "Sekou Doumbouya",
    "url": "https://github.com/fakoli"
  },
  "repository": "https://github.com/fakoli/fakoli-plugins",
  "license": "MIT",
  "mcpServers": "./.mcp.json",
  "keywords": [
    "agent-coordination",
    "claims",
    "evidence-based",
    "llm-work-packets",
    "local-first",
    "mcp",
    "project-state",
    "runtime-neutral",
    "sqlite",
    "terraform-for-work"
  ]
}
